commit	compression_score	compression_ratio	val_bpb_delta	compressed_bpb	status	description
3ea7ab3	1.000000	1.0000	0.000000	1.391715	keep	identity baseline (no compression, reference)
787fff4	1.958804	1.9592	0.000038	1.504972	keep	int8 sym per-tok-per-head quant
58cebb1	3.807015	3.8400	0.003299	1.507150	keep	int4 sym per-tok-per-head quant
1d5de19	4.607514	7.3846	0.277710	1.781829	keep	int2 sym per-tok-per-head quant
8a0c1b2	3.182674	3.2000	0.001733	1.503347	discard	int4 group_size=16 (overhead beat by vanilla int4)
9b1d2c3	2.654981	2.6667	0.001169	1.514881	discard	int4 group_size=8 (overhead too high)
ac2e3d4	3.683132	3.6923	0.000918	1.714273	discard	asymmetric int4 (better quality but more overhead)
bd1e5f6	4.133966	6.0000	0.186603	2.107769	discard	random projection rank=32 (Johnson-Lindenstrauss, lossy)
e588bfb	5.942022	6.1563	0.021429	1.922298	keep	hybrid recent=64 bf16 + old INT2 quant
90aea70	0.000000	0.0000	0.000000	0.000000	marker	===== substrate change: D=6 A=64 (medium) baseline_bpb=1.093 — entries below are on this substrate =====
90aea70	-0.014182	16.0000	1.601418	2.694578	discard	sliding_window_128 [medium bpt=96.00 α20=-16.028 α50=-64.071] — pure eviction is brutal
90aea70	1.958972	1.9592	0.000021	1.093180	keep	int8_sym_per_tok_per_head [medium bpt=784.00 α20=1.958761 α50=1.958128]
90aea70	3.804338	3.8400	0.003566	1.096725	keep	int4_sym_per_tok_per_head [medium bpt=400.00 α20=3.768676 α50=3.661690]
ba2844f	15.547822	32.0000	1.645218	2.738377	discard	sliding_window_64 [medium bpt=48.00 α20=-0.904 α50=-50.261] — α10 wins on ratio alone but quality cliff
699997e	-7.077435	8.0000	1.507743	2.600902	discard	sliding_window_256 [medium bpt=192.00 α20=-22.154870 α50=-67.387174]
699997e	-9.062370	4.0000	1.306237	2.399396	discard	sliding_window_512 [medium bpt=384.00 α20=-22.124740 α50=-61.311850]
423ca02	0.219795	15.5152	1.529536	2.622695	discard	sink4_W128 [medium bpt=99.00 α20=-15.075561 α50=-60.961631]
423ca02	-6.482660	7.8769	1.435958	2.529117	discard	sink4_W256 [medium bpt=195.00 α20=-20.842243 α50=-63.920991]
423ca02	14.382807	30.1176	1.573484	2.666643	discard	sink4_W64 [medium bpt=51.00 α20=-1.352034 α50=-48.556555] — α10 false-keep, fixed by α20 gate
423ca02	-1.710306	1.9982	0.370852	1.464011	discard	topk_knorm_50pct [medium bpt=768.69 α20=-5.418823 α50=-16.544374]
423ca02	-0.076287	1.3321	0.140843	1.234002	discard	topk_knorm_75pct [medium bpt=1153.03 α20=-1.484715 α50=-5.709998]
423ca02	-3.648673	3.9964	0.764510	1.857669	discard	topk_knorm_25pct [medium bpt=384.34 α20=-11.293768 α50=-34.229055]
423ca02	-3.476517	12.0000	1.547652	2.640811	discard	svd_r32 [medium bpt=128.00 α20=-18.953035 α50=-65.382586]
423ca02	7.910037	24.0000	1.608996	2.702155	discard	svd_r16 [medium bpt=64.00 α20=-8.179925 α50=-56.449813]
423ca02	31.709337	48.0000	1.629066	2.722225	discard	svd_r8 [medium bpt=32.00 α20=15.418675 α50=-33.453314] — α10 false-keep, fixed by α20 gate (Δ>>0.1)
423ca02	-1.158702	1.3333	0.249204	1.342363	discard	headprune_1of4 [medium bpt=1152.00 α20=-3.650737 α50=-11.126842]
423ca02	-3.977053	2.0000	0.597705	1.690864	discard	headprune_2of4 [medium bpt=768.00 α20=-9.954105 α50=-27.885263]
ac0557e	2.902247	7.3846	0.448237	1.541396	discard	int2_sym_per_tok_per_head [medium bpt=208.00 α20=-1.580122 α50=-15.027229]
ac0557e	1.777793	6.1563	0.437852	1.531011	discard	hybrid_recent64_int2_old [medium bpt=249.50 α20=-2.600727 α50=-15.736287]
ac0557e	3.491913	3.5270	0.003507	1.096666	discard	hybrid_recent64_int4_old [medium bpt=435.50 α20=3.456846 α50=3.351645]
ac0557e	1.023957	5.2784	0.425439	1.518598	discard	hybrid_recent128_int2_old [medium bpt=291.00 α20=-3.230437 α50=-15.993618]
ac0557e	15.640061	30.7200	1.507994	2.601153	discard	stack_sliding_window_256+int4_sym_per_tok_per_head [medium bpt=50.00 α20=0.560123 α50=-44.679693]
ac0557e	15.892512	30.2474	1.435487	2.528646	discard	stack_sink4_W256+int4_sym_per_tok_per_head [medium bpt=50.78 α20=1.537639 α50=-41.526978]
ac0557e	2.586808	5.1200	0.253319	1.346478	discard	stack_headprune_1of4+int4_sym_per_tok_per_head [medium bpt=300.00 α20=0.053616 α50=-7.545959]
PENDING	0.000000	0.0000	0.000000	0.000000	marker	===== substrate change: D=3 A=40 (small) — entries below are on this substrate =====
376598d	3.763710	3.8400	0.007629	1.191244	keep	int4_sym_per_tok_per_head [small bpt=200.00 α20=3.687420 α50=3.458551]
376598d	1.958558	1.9592	0.000063	1.183677	discard	int8_sym_per_tok_per_head [small bpt=392.00 α20=1.957932 α50=1.956055]
376598d	1.517056	7.3846	0.586756	1.770371	discard	int2_sym_per_tok_per_head [small bpt=104.00 α20=-4.350503 α50=-21.953181]
376598d	3.161697	3.2000	0.003830	1.187445	discard	int4_group16 [small bpt=240.00 α20=3.123394 α50=3.008485]
376598d	3.642463	3.6923	0.004984	1.188599	discard	int4_asym_per_tok_per_head [small bpt=208.00 α20=3.592618 α50=3.443083]
376598d	0.412321	6.1563	0.574399	1.758014	discard	hybrid_recent64_int2_old [small bpt=124.75 α20=-5.331671 α50=-22.563646]
376598d	-4.374422	16.0000	2.037442	3.221057	discard	sliding_window_128 [small bpt=48.00 α20=-24.748844 α50=-85.872109]
PENDING	0.000000	0.0000	0.000000	0.000000	marker	===== substrate change: D=10 A=80 (large) — entries below are on this substrate =====
376598d	0.000000	0.0000	0.000000	0.000000	crash	int4 [large]
376598d	3.821816	3.8400	0.001818	1.143504	keep	int4_sym_per_tok_per_head [large bpt=900.00 α20=3.803633 α50=3.749082]
376598d	1.959008	1.9592	0.000018	1.141704	discard	int8_sym_per_tok_per_head [large bpt=1764.00 α20=1.958832 α50=1.958303]
376598d	5.115474	7.3846	0.226914	1.368600	discard	int2_sym_per_tok_per_head [large bpt=468.00 α20=2.846333 α50=-3.961091]
376598d	3.189568	3.2000	0.001043	1.142729	discard	int4_group16 [large bpt=1080.00 α20=3.179136 α50=3.147840]
376598d	3.679671	3.6923	0.001264	1.142950	discard	int4_asym_per_tok_per_head [large bpt=936.00 α20=3.667034 α50=3.629123]
376598d	2.659687	2.6667	0.000698	1.142384	discard	int4_group8 [large bpt=1296.00 α20=2.652706 α50=2.631766]
376598d	3.509114	3.5270	0.001787	1.143473	discard	hybrid_recent64_int4_old [large bpt=979.88 α20=3.491248 α50=3.437650]
db15bd6	2.582107	2.5946	0.001249	1.094408	discard	mixed_K8_V4 [medium bpt=592.00 α20=2.569620 α50=2.532158]
db15bd6	2.572307	2.5946	0.002229	1.095388	discard	mixed_K4_V8 [medium bpt=592.00 α20=2.550018 α50=2.483154]
db15bd6	2.112790	3.0968	0.098398	1.191557	discard	mixed_K8_V2 [medium bpt=496.00 α20=1.128806 α50=-1.823147]
db15bd6	4.035659	5.0526	0.101697	1.194856	discard	mixed_K4_V2 [medium bpt=304.00 α20=3.018686 α50=-0.032233]
PENDING	0.000000	0.0000	0.000000	0.000000	marker	===== HEAD_DIM=64 sweep at medium (D=6 A=64) =====
0209f92	3.730160	3.7647	0.003455	1.101875	keep	int4_sym_per_tok_per_head [hd64 bpt=408.00 α20=3.695613 α50=3.591975]
0209f92	3.179305	3.2000	0.002069	1.100489	discard	int4_group16 [hd64 bpt=480.00 α20=3.158610 α50=3.096526]
0209f92	2.651641	2.6667	0.001503	1.099922	discard	int4_group8 [hd64 bpt=576.00 α20=2.636616 α50=2.591539]
0209f92	3.529091	3.5556	0.002646	1.101066	discard	int4_group32 [hd64 bpt=432.00 α20=3.502626 α50=3.423231]
0209f92	1.939154	1.9394	0.000024	1.098444	discard	int8_sym_per_tok_per_head [hd64 bpt=792.00 α20=1.938915 α50=1.938196]
0209f92	3.917127	7.1111	0.319398	1.417818	discard	int2_sym_per_tok_per_head [hd64 bpt=216.00 α20=0.723142 α50=-8.858811]
PENDING	0.000000	0.0000	0.000000	0.000000	marker	===== HEAD_DIM=128 sweep at medium (D=6 A=64) =====
5200e5d	3.840911	3.8788	0.003788	1.099647	keep	int4_sym_per_tok_per_head [hd128 bpt=396.00 α20=3.803033 α50=3.689401]
a985069	3.181177	3.2000	0.001882	1.097741	discard	int4_group16 [hd128 bpt=480.00 α20=3.162353 α50=3.105883]
a985069	3.530845	3.5556	0.002471	1.098330	discard	int4_group32 [hd128 bpt=432.00 α20=3.506135 α50=3.432003]
a985069	3.735003	3.7647	0.002970	1.098829	discard	int4_group64 [hd128 bpt=408.00 α20=3.705300 α50=3.616192]
a985069	1.968951	1.9692	0.000028	1.095887	discard	int8_sym_per_tok_per_head [hd128 bpt=780.00 α20=1.968672 α50=1.967834]
a985069	3.133221	7.5294	0.439619	1.535478	discard	int2_sym_per_tok_per_head [hd128 bpt=204.00 α20=-1.262970 α50=-14.451543]
PENDING	0.000000	0.0000	0.000000	0.000000	marker	===== substrate change: medium (DEPTH=6, ASPECT_RATIO=64, HEAD_DIM=96) =====
5b5dd52	1.959006	1.9592	0.000018	1.093177	discard	int8_sym_per_tok_per_head [medium bpt=784.00 α20=1.958828 α50=1.958295]
9627378	3.804338	3.8400	0.003566	1.096725	discard	int4_sym_per_tok_per_head [medium bpt=400.00 α20=3.768676 α50=3.661690]
98148a0	2.902247	7.3846	0.448237	1.541396	discard	int2_sym_per_tok_per_head [medium bpt=208.00 α20=-1.580122 α50=-15.027229]
0d911ae	3.181845	3.2000	0.001815	1.094974	discard	int4_group16 [medium bpt=480.00 α20=3.163690 α50=3.109226]
0d911ae	3.669481	3.6923	0.002283	1.095442	discard	int4_asym_per_tok_per_head [medium bpt=416.00 α20=3.646655 α50=3.578177]
0d911ae	3.491913	3.5270	0.003507	1.096666	discard	hybrid_recent64_int4_old [medium bpt=435.50 α20=3.456846 α50=3.351645]
0d911ae	2.582107	2.5946	0.001249	1.094408	discard	mixed_K8_V4 [medium bpt=592.00 α20=2.569620 α50=2.532158]
c546bea	2.560845	2.5946	0.003375	1.186990	discard	mixed_K8_V4 [small bpt=296.00 α20=2.527095 α50=2.425846]
c546bea	2.551431	2.5946	0.004316	1.187931	discard	mixed_K4_V8 [small bpt=296.00 α20=2.508267 α50=2.378777]
c546bea	0.854383	3.0968	0.224239	1.407854	discard	mixed_K8_V2 [small bpt=248.00 α20=-1.388009 α50=-8.115183]
c546bea	2.767409	5.0526	0.228522	1.412137	discard	mixed_K4_V2 [small bpt=152.00 α20=0.482186 α50=-6.373481]
c546bea	2.588314	2.5946	0.000628	1.142314	discard	mixed_K8_V4 [large bpt=1332.00 α20=2.582034 α50=2.563192]
c546bea	2.582271	2.5946	0.001232	1.142918	discard	mixed_K4_V8 [large bpt=1332.00 α20=2.569948 α50=2.532978]
c546bea	2.625544	3.0968	0.047123	1.188809	discard	mixed_K8_V2 [large bpt=1116.00 α20=2.154314 α50=0.740624]
c546bea	4.562936	5.0526	0.048970	1.190656	keep	mixed_K4_V2 [large bpt=684.00 α20=4.073241 α50=2.604155]
e672d7a	-2.221223	1.9361	0.415736	1.599351	discard	h2o_R64_K50pct [small bpt=396.67 α20=-6.378583 α50=-18.850664]
1f15d3a	-3.074720	3.6542	0.672897	1.766056	discard	h2o_R64_K25pct [medium bpt=420.33 α20=-9.803686 α50=-29.990584]
1f15d3a	-1.248275	1.9378	0.318604	1.411763	discard	h2o_R64_K50pct [medium bpt=792.67 α20=-4.434315 α50=-13.992435]
1f15d3a	0.312029	1.3185	0.100643	1.193802	discard	h2o_R64_K75pct [medium bpt=1165.00 α20=-0.694399 α50=-3.713681]
1f15d3a	-1.232361	1.8809	0.311323	1.404482	discard	h2o_R128_K50pct [medium bpt=816.64 α20=-4.345589 α50=-13.685274]
6de5ab7	-4.570593	3.6514	0.822195	2.005809	discard	h2o_R64_K25pct [small bpt=210.33 α20=-12.792539 α50=-37.458376]
6de5ab7	0.541712	1.2394	0.069768	1.162927	discard	h2o_R64_K80pct [medium bpt=1239.32 α20=-0.155970 α50=-2.249015]
6de5ab7	-2.221223	1.9361	0.415736	1.599351	discard	h2o_R64_K50pct [small bpt=396.67 α20=-6.378583 α50=-18.850664]
6de5ab7	0.000000	0.0000	0.000000	0.000000	crash	h2o_R64_K75pct [small]
6de5ab7	0.739329	1.1693	0.042995	1.136154	discard	h2o_R64_K85pct [medium bpt=1313.63 α20=0.309381 α50=-0.980464]
6de5ab7	0.892355	1.1061	0.021372	1.114531	discard	h2o_R64_K90pct [medium bpt=1388.70 α20=0.678639 α50=0.037490]
6de5ab7	-0.150533	1.3173	0.146786	1.330401	discard	h2o_R64_K75pct [small bpt=583.00 α20=-1.618392 α50=-6.021969]
8dacb00	-2.202404	3.6559	0.585826	1.727512	discard	h2o_R64_K25pct [large bpt=945.33 α20=-8.060663 α50=-25.635439]
8dacb00	-0.830020	1.9387	0.276869	1.418555	discard	h2o_R64_K50pct [large bpt=1782.67 α20=-3.598710 α50=-11.904779]
8dacb00	0.390867	1.3191	0.092822	1.234508	discard	h2o_R64_K75pct [large bpt=2620.00 α20=-0.537349 α50=-3.322000]
8dacb00	3.861127	3.8788	0.001766	1.135064	keep	int4_sym_per_tok_per_head [hd128_large bpt=924.00 α20=3.843466 α50=3.790484]
8dacb00	2.660680	2.6667	0.000599	1.133897	discard	int4_group8 [hd128_large bpt=1344.00 α20=2.654693 α50=2.636733]
8dacb00	3.191766	3.2000	0.000823	1.134121	discard	int4_group16 [hd128_large bpt=1120.00 α20=3.183533 α50=3.158832]
8dacb00	3.544532	3.5556	0.001102	1.134400	discard	int4_group32 [hd128_large bpt=1008.00 α20=3.533509 α50=3.500438]
8dacb00	4.650731	5.1200	0.046927	1.180225	keep	mixed_K4_V2 [hd128_large bpt=700.00 α20=4.181462 α50=2.773655]
8dacb00	2.606259	2.6122	0.000599	1.133897	discard	mixed_K8_V4 [hd128_large bpt=1372.00 α20=2.600272 α50=2.582314]
b4597f8	3.897323	4.9231	0.102575	1.200995	discard	mixed_K4_V2 [hd64 bpt=312.00 α20=2.871569 α50=-0.205694]
b4597f8	3.949423	5.1200	0.117058	1.212917	discard	mixed_K4_V2 [hd128 bpt=300.00 α20=2.778845 α50=-0.732887]
b4597f8	3.470345	5.0526	0.158229	1.299915	discard	mixed_K2_V4 [large bpt=684.00 α20=1.888059 α50=-2.858800]
b4597f8	3.398853	5.1200	0.172115	1.305413	discard	mixed_K2_V4 [hd128_large bpt=700.00 α20=1.677705 α50=-3.485737]
b4597f8	0.729115	1.1698	0.044072	1.185758	discard	h2o_R64_K85pct [large bpt=2954.26 α20=0.288393 α50=-1.033775]
5c26283	1.524961	3.0968	0.157181	1.298867	discard	mixed_K2_V8 [large bpt=1116.00 α20=-0.046852 α50=-4.762290]
5c26283	1.413222	3.1220	0.170873	1.304171	discard	mixed_K2_V8 [hd128_large bpt=1148.00 α20=-0.295508 α50=-5.421696]
5c26283	2.668645	3.1220	0.045331	1.178629	discard	mixed_K8_V2 [hd128_large bpt=1148.00 α20=2.215338 α50=0.855418]
be6b1bb	0.000000	0.0000	0.000000	0.000000	crash	stack:h2o_R64_K75pct+int4 [medium]
be6b1bb	4.011983	5.0629	0.105089	1.198248	discard	stack_h2o_R64_K75pct+int4_sym_per_tok_per_head [medium bpt=303.39 α20=2.961094 α50=-0.191571]
be6b1bb	4.115699	5.0653	0.094959	1.236645	discard	stack_h2o_R64_K75pct+int4_sym_per_tok_per_head [large bpt=682.29 α20=3.166113 α50=0.317356]
